checked_at,stage,keyword,title,topic_type,search_intent,decision,reason,matched_source,matched_title,matched_url,keyword_exact_match,intent_core_match,title_similarity,body_similarity,structural_similarity
2026-05-13 13:37:09,writing_queue,노션 공식 템플릿 커스터마이징 실무 가이드,노션 공식 템플릿 커스터마이징 실무 가이드 업무에 적용하는 단계별 방법,practical_usage,practical,review,moderate title overlap,previous_posts,[Notion] 노션 템플릿 복사해서 사용하는 방법,https://raphaelstory777.tistory.com/95,0,0,0.5,0.0,0.0
2026-05-13 13:37:09,writing_queue,노션 서브페이지와 링크 데이터베이스로 지식 정리,노션 서브페이지와 링크 데이터베이스로 지식 정리 업무에 적용하는 단계별 방법,practical_usage,practical,pass,no strong duplicate signal detected,,,,0,0,0.0,0.0,0.0
2026-05-13 13:37:09,writing_queue,노션으로 주간 플래너와 할 일 목록 자동화,노션으로 주간 플래너와 할 일 목록 자동화 실무에서 바로 쓰는 방법,practical_usage,practical,pass,no strong duplicate signal detected,,,,0,0,0.0,0.0,0.0
2026-05-13 13:37:13,writing_queue,블렌더 모디파이어 로컬 vs 오브젝트 좌표 차이,블렌더 모디파이어 로컬 vs 오브젝트 좌표 차이 차이점과 선택 기준 정리,comparison_analysis,comparison,pass,no strong duplicate signal detected,,,,0,0,0.0,0.0,0.0
2026-05-13 13:37:13,writing_queue,블렌더 렌더 엔진 Cycles vs Eevee 선택 기준,블렌더 렌더 엔진 Cycles vs Eevee 선택 기준 차이점과 선택 기준 정리,comparison_analysis,comparison,pass,no strong duplicate signal detected,,,,0,0,0.0,0.0,0.0
2026-05-13 13:37:15,writing_queue,워드 프로세서 컴퓨터 활용 능력 차이,워드 프로세서 컴퓨터 활용 능력 차이 차이를 이해하고 선택하는 방법,comparison_analysis,comparison,review,moderate title overlap,previous_posts,피츠의 법칙 활용 방법,https://ochosblogg.blogspot.com/2024/10/blog-post_3.html,0,0,0.5,0.0,0.0
2026-05-13 13:37:15,writing_queue,트렐로 vs 아사나 vs 노션 업무 도구 비교,트렐로 vs 아사나 vs 노션 업무 도구 비교 차이를 이해하고 선택하는 방법,comparison_analysis,comparison,pass,no strong duplicate signal detected,,,,0,0,0.0,0.0,0.0
2026-05-13 13:37:15,writing_queue,microsoft 365 기본 버전 64 비트 차이,microsoft 365 기본 버전 64 비트 차이 어떤 상황에서 무엇을 골라야 하는지 정리,comparison_analysis,comparison,pass,no strong duplicate signal detected,,,,0,0,0.0,0.0,0.0
2026-05-13 13:37:15,writing_queue,mac vscode python 설정,mac vscode python 설정 어떤 상황에서 무엇을 골라야 하는지 정리,comparison_analysis,comparison,pass,no strong duplicate signal detected,,,,0,0,0.0,0.0,0.0
2026-05-13 13:37:15,writing_queue,우분투 vscode python 설정,우분투 vscode python 설정 어떤 상황에서 무엇을 골라야 하는지 정리,comparison_analysis,comparison,pass,no strong duplicate signal detected,,,,0,0,0.0,0.0,0.0
2026-05-13 13:37:15,writing_queue,SSD 용량 부족 시 파일 정리 실무 도구 비교,SSD 용량 부족 시 파일 정리 실무 도구 비교 비교할 때 먼저 봐야 할 핵심,comparison_analysis,comparison,pass,no strong duplicate signal detected,,,,0,0,0.0,0.0,0.0
2026-05-13 13:37:15,writing_queue,워드 실무에서 Copilot 정보 합성 vs 병합 기능 차이,워드 실무에서 Copilot 정보 합성 vs 병합 기능 차이 차이점과 선택 기준 정리,comparison_analysis,comparison,review,moderate title overlap,writing_queue_selected,블렌더 렌더 엔진 Cycles vs Eevee 선택 기준 차이점과 선택 기준 정리,,0,0,0.5,0.0,0.0
2026-05-13 13:37:15,writing_queue,vscode 유니티 설정,vscode 유니티 설정 어떤 상황에서 무엇을 골라야 하는지 정리,comparison_analysis,comparison,pass,no strong duplicate signal detected,,,,0,0,0.0,0.0,0.0
2026-05-13 13:37:15,writing_queue,vscode unity 설정,vscode unity 설정 차이점과 선택 기준 정리,comparison_analysis,comparison,review,moderate title overlap,writing_queue_selected,블렌더 렌더 엔진 Cycles vs Eevee 선택 기준 차이점과 선택 기준 정리,,0,0,0.5714,0.0,0.0
2026-05-13 13:37:15,writing_queue,엑셀 비교 그래프 만들기,엑셀 비교 그래프 만들기 차이를 이해하고 선택하는 방법,comparison_analysis,comparison,pass,no strong duplicate signal detected,,,,0,0,0.0,0.0,0.0
2026-05-13 13:37:15,writing_queue,엑셀 차이 구하는 방법,엑셀 차이 구하는 방법 차이점과 선택 기준 정리,comparison_analysis,comparison,review,moderate title overlap,previous_posts,[Office365] 엑셀 색상 기준 정렬 방법,https://blog.naver.com/wlss7/224242659147?fromRss=true&trackingCode=rss,0,0,0.5,0.0,0.0
2026-05-13 13:37:15,writing_queue,워드 비교본 저장 방법,워드 비교본 저장 방법 차이점과 선택 기준 정리,comparison_analysis,comparison,review,moderate title overlap,previous_posts,[Office365] 워드 그림 삽입 방법 정리,https://raphaelstory777.tistory.com/67,0,0,0.5,0.0,0.0
2026-05-13 13:37:15,writing_queue,vscode 파이썬 설정,vscode 파이썬 설정 어떤 상황에서 무엇을 골라야 하는지 정리,comparison_analysis,comparison,pass,no strong duplicate signal detected,,,,0,0,0.0,0.0,0.0
2026-05-13 13:37:15,writing_queue,vs 코드 파이썬 설정,vs 코드 파이썬 설정 차이점과 선택 기준 정리,comparison_analysis,comparison,review,moderate title overlap,writing_queue_selected,블렌더 렌더 엔진 Cycles vs Eevee 선택 기준 차이점과 선택 기준 정리,,0,0,0.625,0.0,0.0
2026-05-13 13:37:19,writing_queue,vscode 파이썬 사용법,vscode 파이썬 사용법 어떤 상황에서 무엇을 골라야 하는지 정리,comparison_analysis,comparison,pass,no strong duplicate signal detected,,,,0,0,0.0,0.0,0.0
2026-05-13 13:37:19,writing_queue,vscode python 사용법,vscode python 사용법 비교할 때 먼저 봐야 할 핵심,comparison_analysis,comparison,pass,no strong duplicate signal detected,,,,0,0,0.0,0.0,0.0
2026-05-13 13:37:19,writing_queue,vscode python 설정,vscode python 설정 어떤 상황에서 무엇을 골라야 하는지 정리,comparison_analysis,comparison,pass,no strong duplicate signal detected,,,,0,0,0.0,0.0,0.0
2026-05-13 13:37:19,writing_queue,vsc python 설정,vsc python 설정 비교할 때 먼저 봐야 할 핵심,comparison_analysis,comparison,pass,no strong duplicate signal detected,,,,0,0,0.0,0.0,0.0
2026-05-13 13:37:19,writing_queue,unity awake start 차이,unity awake start 차이 차이점과 선택 기준 정리,comparison_analysis,comparison,review,moderate title overlap,writing_queue_selected,블렌더 렌더 엔진 Cycles vs Eevee 선택 기준 차이점과 선택 기준 정리,,0,0,0.5,0.0,0.0
